1;de;Testseite;Nur eine Testseite. Stellt verschiedene Contentblöcke dar.
1;en;Testpage;Just a Testpage. Displays various content blocks.
2;de;Media Seite;xamoom kann auch multimedia. Stellt Videos, Audio und Bilder dar.
2;en;Media Page;xamoom can also handle multimedia. Displays videos, audio and images.
3;de;Ebook Seite;Ebup, Mobi, etc. Zeigt wie Ebook downloads aussehen.
3;en;Ebook Page;Epub, Mob and so on. Shows how ebook downloads look like.
4;de;Link Seite;Weblinks, Tel., Mail, etc. Zeigt wie die verschiedenen Links aussehen.
4;en;Link Page;Web, tel, mail and so  on. Shows how the different link types look like.